{
  "id": "session-event-tool-completed",
  "domain": "session_event",
  "input": {
    "event": {
      "kind": "tool_completed",
      "callId": "call-weather",
      "isError": false,
      "content": {
        "blocks": [{ "type": "text", "text": "sunny" }]
      }
    }
  },
  "expected": {
    "canonical": {
      "kind": "tool_completed",
      "callId": "call-weather",
      "isError": false,
      "blockTypes": ["text"]
    }
  }
}
