{
  "id": "session-event-vocabulary",
  "domain": "session_event_vocabulary",
  "input": {},
  "expected": {
    "canonical": {
      "kinds": [
        "agent_process_changed",
        "budget_exceeded",
        "budget_usage_reported",
        "capability_changed",
        "checkpoint_taken",
        "compressed",
        "context_prepared",
        "context_renewed",
        "entropy_alert",
        "entropy_sample",
        "group_budget_charged",
        "group_member_joined",
        "kernel_observation",
        "llm_completed",
        "memory_queried",
        "memory_query_failed",
        "memory_retrieval_result",
        "memory_validation_failed",
        "memory_write_failed",
        "memory_written",
        "milestone_advanced",
        "milestone_blocked",
        "operation_cancelled",
        "page_in",
        "page_out",
        "permission_requested",
        "permission_resolved",
        "prompt_measured",
        "provider_attempt",
        "resumed",
        "rollbacked",
        "round_paced",
        "round_started",
        "run_started",
        "run_terminal",
        "semantic_archive_completed",
        "semantic_archive_failed",
        "semantic_archive_pending",
        "signal_delivery_disposed",
        "summary_upgraded",
        "suspended",
        "tool_argument_repaired",
        "tool_completed",
        "tool_denied",
        "tool_gated",
        "tool_requested",
        "workflow_batch_spawned",
        "workflow_completed",
        "workflow_node_completed",
        "workflow_nodes_submitted"
      ],
      "count": 50
    }
  }
}
